Human Action Recognition System using Good Features and Multilayer Perceptron Network;Jonti Talukdar, Bhavana Mehta;Human action recognition involves the characterization of human actions through the automated analysis of video data and is integral in the development of smart computer vision systems. However, several challenges like dynamic backgrounds, camera stabilization, complex actions, occlusions etc. make action recognition in a real time and robust fashion difficult. Several complex approaches exist but are computationally intensive. This paper presents a novel approach of using a combination of good features along with iterative optical flow algorithm to compute feature vectors which are classified using a multilayer perceptron (MLP) network. The use of multiple features for motion descriptors enhances the quality of tracking. Resilient backpropagation algorithm is used for training the feedforward neural network reducing the learning time. The overall system accuracy is improved by optimizing the various parameters of the multilayer perceptron network.;https://arxiv.org/abs/1708.06794
What caused what? An irreducible account of actual causation;Larissa Albantakis, William Marshall, Erik Hoel, Giulio Tononi;"Actual causation is concerned with the question ""what caused what?"". Consider a transition between two subsequent observations within a system of elements. Even under perfect knowledge of the system, a straightforward answer to this question may not be available. Counterfactual accounts of actual causation based on graphical models, paired with system interventions, have demonstrated initial success in addressing specific problem cases. We present a formal account of actual causation, applicable to discrete dynamical systems of interacting elements, that considers all counterfactual states of a state transition from t-1 to t. Within such a transition, causal links are considered from two complementary points of view: we can ask if any occurrence at time t has an actual cause at t-1, but also if any occurrence at time t-1 has an actual effect at t. We address the problem of identifying such actual causes and actual effects in a principled manner by starting from a set of basic requirements for causation (existence, composition, information, integration, and exclusion). We present a formal framework to implement these requirements based on system manipulations and partitions. This framework is used to provide a complete causal account of the transition by identifying and quantifying the strength of all actual causes and effects linking two occurrences. Finally, we examine several exemplary cases and paradoxes of causation and show that they can be illuminated by the proposed framework for quantifying actual causation.";https://arxiv.org/abs/1708.06716
The Continuous Hint Factory - Providing Hints in Vast and Sparsely Populated Edit Distance Spaces;Benjamin Paaßen, Barbara Hammer, Thomas William Price, Tiffany Barnes, Sebastian Gross, Niels Pinkwart;Intelligent tutoring systems can support students in solving multi-step tasks by providing a hint regarding what to do next. However, engineering such next-step hints manually or using an expert model becomes infeasible if the space of possible states is too large. Therefore, several approaches have emerged to infer next-step hints automatically, relying on past student's data. Such hints typically have the form of an edit which could have been performed by capable students in the given situation, based on what past capable students have done. In this contribution we provide a mathematical framework to analyze edit-based hint policies and, based on this theory, propose a novel hint policy to provide edit hints for learning tasks with a vast state space and sparse student data. We call this technique the continuous hint factory because it embeds student data in a continuous space, in which the most likely edit can be inferred in a probabilistic sense, similar to the hint factory.;
Reinforcement Learning in POMDPs with Memoryless Options and Option-Observation Initiation Sets;Denis Steckelmacher, Diederik M. Roijers, Anna Harutyunyan, Peter Vrancx, Ann Nowé;Most real-world reinforcement learning problems have a hierarchical nature, and often exhibit some degree of partial observability. While hierarchy and partial observability are usually tackled separately, for instance by combining recurrent neural networks and options, we show that addressing both problems simultaneously is simpler and more efficient in many cases. More specifically, we make the initiation set of options conditional on the previously-executed option, and show that options with such Option-Observation Initiation Sets (OOIs) are at least as expressive as Finite State Controllers (FSCs), a state-of-the-art approach for learning in POMDPs. In contrast to other hierarchical methods in partially observable environments, OOIs are easy to design based on an intuitive description of the task, lead to explainable policies and keep the top-level and option policies memoryless. Our experiments show that OOIs allow agents to learn optimal policies in challenging POMDPs, outperforming an human-provided policy in our robotic experiment, while learning much faster than a recurrent neural network over options.;https://arxiv.org/abs/1708.06551
Software engineering and the SP theory of intelligence;J Gerard Wolff;"This paper describes a novel approach to software engineering derived from the ""SP theory of intelligence"" and its realisation in the ""SP computer model"". These are the bases of a projected industrial-strength ""SP machine"" which, when mature, is anticipated to be the vehicle for software engineering as described in this paper. Potential benefits of this new approach to software engineering include: the automation of semi-automation of software development, with non-automatic programming of the SP system where necessary allowing programmers to concentrate on 'real-world' parallelism, without worries about parallelism to speed up processing the ambitious long-term goal of programming the SP system via written or spoken natural language reducing or eliminating the distinction between 'design' and 'implementation' reducing or eliminating operations like compiling or interpretation reducing or eliminating the need for verification of software reducing the need for an explicit process of validation of software no formal distinction between program and database potential for substantial reductions in the number of types of data file and the number of computer languages benefits for version control and reducing technical debt.";https://arxiv.org/abs/1708.06665
Learning Efficient Convolutional Networks through Network Slimming;Zhuang Liu, Jianguo Li, Zhiqiang Shen, Gao Huang, Shoumeng Yan, Changshui Zhang;The deployment of deep convolutional neural networks (CNNs) in many real world applications is largely hindered by their high computational cost. In this paper, we propose a novel learning scheme for CNNs to simultaneously 1) reduce the model size 2) decrease the run-time memory footprint and 3) lower the number of computing operations, without compromising accuracy. This is achieved by enforcing channel-level sparsity in the network in a simple but effective way. Different from many existing approaches, the proposed method directly applies to modern CNN architectures, introduces minimum overhead to the training process, and requires no special software/hardware accelerators for the resulting models. We call our approach network slimming, which takes wide and large networks as input models, but during training insignificant channels are automatically identified and pruned afterwards, yielding thin and compact models with comparable accuracy. We empirically demonstrate the effectiveness of our approach with several state-of-the-art CNN models, including VGGNet, ResNet and DenseNet, on various image classification datasets. For VGGNet, a multi-pass version of network slimming gives a 20x reduction in model size and a 5x reduction in computing operations.;https://arxiv.org/abs/1708.06519
